id,title,selftext,created_utc,subreddit,group
1m0xp7b,Harvard 2+2 deadlines,"Hi everyone. I am so sad, I think I missed the deadline to apply for the 2+2 program. I wanted to have already applied, but I noticed on the website it said your graduation date has to be between certain dates. My undergrad school is a bit different, so I’m not technically walking the stage until November so this would mean I fall into the 2026 application window. However, I just learned today my conferral date is 9/1 which would mean I would fall into the 2025 application and thus missed the deadline. Does anyone have any stories or suggestions or options I might have? I am so sad and angry that I might have missed my only opportunity for this.",1752623376.0,MBA,Business
1m040nj,27 and terrified of this job market,"Hi, I’m 27F currently working in an ad tech startup as an account manager with TC $105K.  I should preface this by saying I do not have family’s financial support in pursuing an MBA, so would be relying on loans/scholarships. I currently work in media and I keep hearing that this is a dying industry. I’ve wanted to go back to school for a few years but had difficulty justifying it because I wasn’t sure what program I’d have done or where i’d apply my degree. I’ve realized I really am curious about the ins and outs of business and would enjoy consulting with an exit into entertainment/media/tech in house or at an incubator after a few years. I’ll be applying this fall because I don’t want to miss another admissions cycle, but am genuinely terrified of not landing on my feet after completing a T15 MBA - particularly due to the state of the economy and how much AI is changing many industries. I’d have until the spring to decide if I should really go. I know MBAs are a long term investment, but would love to hear your thought process as to why you’re leaning towards doing the program. Penny for your thoughts/advice? Anyone in a similar boat?",1752540868.0,MBA,Business
1m0whov,Workplace by Facebook Alternatives?,FB is shutting down Workplace Aug 1 and my school is shifting everyone into InScribe. It's awful. What are you using that acts simultaneously as a water cooler for hovering alumni and current students who are looking to form groups?,1752620222.0,MBA,Business
1m0pws4,UNC Waitlist,Has anyone heard back from UNC KF regarding their waitlist in this current cycle? There was an email to submit continued interest documents by June 5th so I am kind of expecting to hear back soon but was wondering if anyone has already heard back or has received any other information,1752604717.0,MBA,Business
1m179ne,"Do you think IIMs are overrated in 2025? If yes, why?",,1752654754.0,MBA,Business
1m0k9dm,Military Pathways: JPMorgan Chase Business Relationship Manager,"Hello everyone,

I am interviewing for the position above, and am curious if anyone has had experience with this role and the program. I am trying to understand what exactly the role entails, how the program is structured, and any other tips and helpful advice. I do not have “banking” experience. My background includes four years in the Navy, a bachelors in Business Management, and an MBA in-progress. Thanks in advance!",1752592068.0,MBA,Business
1lzq1vk,Why is this sub so incredibly weird and bad?,I'd just like to know why. The posts aren't what I'd expect to see on an MBA subreddit. ,1752508286.0,MBA,Business
1m0x7wy,Interesting Situation,"Today I was admitted off of the waitlist at a T15 evening MBA. Problem is, after being waitlisted in R2 and waiting a few months I sort of lost interest in my role/company and was planning on leaving mid August; assuming I wouldn’t be admitted. Not really sure what I should do. I worked really hard on studying and my apps and I love the school. Definitely don’t love my job but maybe I could use this as an opportunity to lateral a bit? It’s a startup and I would be remote. Or should I leave and reapply down the line since I’m only 26? Open to opinions.",1752622093.0,MBA,Business
1m12uvz,What colleges should I apply to,,1752638375.0,MBA,Business
1lztotx,"PSA: 10 years post-graduation, people still judge former M7 classmates for negative behavior during the program. Guard your brand and reputation.","I'm 10 years out of the MBA, at an M7 mind you, and I can confidently say people still judge former classmates based on negative things they did during the program. If someone built a reputation for slacking on group assignments, getting consistently overly drunk at social functions, acted weird/creepy toward the other gender, said racist/homophobic stuff, openly did too many hard drugs, cheated on their spouse, people STILL bring up those incidents.

People will use incidents from 10 years ago to justify refusing to give a job referral to someone who acted indecently during the program. It doesn't matter if you've changed and grown, and become a family man or woman, it doesn't matter if you've matured.

People will remember you by how they remember you. You can change and grow all you want, but there's no recognition of redemption. People stop paying attention to social media updates from classmates a few years out, so no one will keep ""tabs"" on your growth.

Almost nothing you can do can salvage your reputation post-MBA. The only exception is if you somehow magically become a celebrity or an indisputable business leader. Which is unlikely for most of the MBA weirdos.

The weirdos who got ostracized during the program had to rely on referrals from classes from other years, not their immediate class, or the part time/exec program.

So be very careful how you show up during the MBA program. People may seem nice and chill but people ARE judging others and making value assessments. Guard your reputation and personal brand at all costs. Have fun, yes, but never be ""that guy."" ",1752516277.0,MBA,Business
1m0oe1l,NYU PT?,"Hey,

I am considering the NYU PT program - currently 8 years of experience mostly in fixed income credit research (6 years). I make approx 200k-215k and what to switch to a career in IB. Is it worth it? Any current or prior students have any insight?

Thanks ",1752601301.0,MBA,Business
1m0o7if,Advice needed: Online MBA vs PT,"Hi, I’m a 32/M Asian, non-practicing MD, currently working in pharma for the past 3 years. I’m a U.S. citizen, earned my MD and practiced in my home country. Current TC: $200k.
Undergrad: associates in international business
Bachelors: Physical therapy

My goal is to advance my career, ideally moving into business development within pharma. I’m not aiming for an M7 MBA. Would an online MBA from be a good choice instead of PT? It seems like this sub only recommends M7 schools. TIA!",1752600899.0,MBA,Business
1m0nvit,PPT courses for IB/Consulting full time?,"Pivoted to IB/Consulting & start full time in a month. I've never worked in any professional services (Consulting/Banking or anything else where I used a lot of PPT/Excel). While I've been able to teach myself Excel & was even able to practice the same through classes, it's not the case with Powerpoint.

  
Seeking recommendations on any useful online Powerpoint courses you've used/seen. Thanks in advance!",1752600174.0,MBA,Business
1m0n7ty,EA for Full time MBA,"Why are there are no threads on Executive assessment 
Does everyone give GMAT or GRE, no body taking the easy route to full time MBA admissions?",1752598726.0,MBA,Business
1m139vj,cattking ne iss saal results nahi kharide ?,,1752639701.0,MBA,Business
1m0kxrr,Forte Fellows for fee waivers,Is it advisable to take forte fellows MBA launch on demand to get fee waivers at schools as a male applicant?,1752593609.0,MBA,Business
1m0j16j,School-specific essays,"For the Columbia co-create essay or other school specific essays, is it safe to assume that they will know any acronyms for popular clubs or programs at the school? (eg HCIA, EiR, HPM)

Might be a stupid question but was wondering if I could save word count there.",1752589220.0,MBA,Business
1m0inqm,INSEAD/LBS Certificate in Global Management,"Hey all,  
I'm 43, currently serving as a VP of Supply Chain at a major feed manufacturing company in a country that isn't part of EU nor USA but I'm an EU citizen . Married with young kids (including a baby on the way), and I already hold a BA + MBA from a local business school. I'm doing around 150k$ annually. 

Lately, I’ve been seriously thinking about pivoting my career into a global tech or finance organization with the attention for global positions outside my country.   
  
That’s where I hit a fork in the road.

On one side: a full-time MBA from a top-tier school like INSEAD, LBS, or maybe even Harvard. I should get global network, strong brand, career reset. But i'll be Leaving work, heavy family responsibilities, and the **crazy cost (up to $200K+).**

On the other: INSEAD’s **Certificate in Global Management** or similar executive programs. Shorter, modular, much cheaper (\~€25K), and lets me keep working, but maybe doesn’t carry the same weight?

Or maybe I don’t need any of it at all, and should just focus on repositioning myself through smarter networking and a solid LinkedIn strategy?

Anyone here made a similar call past 40? Did you go for the degree, or something else? Did it open real doors or was it just branding?",1752588308.0,MBA,Business
1m0htb1,Career Prospects,"I’m 27 and really dislike my current accounting career. My long-term goal is to work in finance, but with my undergrad background, I haven’t been able to land even entry-level finance roles. I’m considering an MBA to help make the switch.

I want to live and work in Seattle, so I’ve been looking at Seattle University and the University of Washington. I’ve already been accepted to Seattle U with a $6K scholarship. Cost-wise, Seattle U would be about a third of UW’s tuition since UW charges out-of-state rates. I don’t come from old money and am funding my own education with loans so this is a very big factor for me. 

I’m not aiming to be in the top 1%, but I do want financial stability and ideally wealth over time. Getting a job associated with investments would be perfect for my interest (though, I do know those roles are extremely competitive).  

For those familiar with the PNW job market: If I earn an MBA from Seattle U with a finance concentration and pair it with CFA Level I, will that open doors to finance roles in Seattle? Or would skipping UW put me at a significant disadvantage?",1752586189.0,MBA,Business
1m0hpe4,"Can former healthcare analysts break into Corporate Finance (FLDP, FPA) roles post MBA?",Basically title. Is getting an internship possible? What helps?,1752585914.0,MBA,Business
1m0ppg6,Applicant with existing MBA,"Anyone here ever apply to an M7 / T15 MBA program, while already having an MBA?

I’m about 3 years out of undergrad, 2 years out of MBA. Got my MBA (not a top ranked program) right after undergrad due to naivety thinking it was inexpensive and would upskill me, without knowing what I wanted to do career-wise.

I’m in FDD / TAS now at a big4 with 2YOE and am considering applying next year so that I can recruit into banking, which would mean I’d aim for the top programs. Would the existing degree be a blocker/affect my application?",1752604258.0,MBA,Business
1m0nbk1,Advice needed: ISB vs M10/Insead,"Hi everyone! I’m from India and have received an ISB YLP admit for the batch of 2026-27. I currently work at an impact consulting firm and will have ~2.5 years of work experience when I join ISB next year. 

I am keen to take a shot at applying abroad (M10/Insead etc), however, might have to give up my ISB admit in doing so. 

I could potentially try to defer my ISB admission by a year but only want to do this if I have a strong chance of converting an M10/Insead by applying next year. What are my chances of doing so, given that:
- I’ll have ~3-3.5 years of work experience at the time of application — is this too little?
- I have a fairly good GMAT score of 750
- Not sure how favourable the US is right now for foreign students
- I do want to return to India in the long term but open to working abroad for a few years post MBA

Any advice on whether I should try to defer my ISB admit and apply for abroad MBA (based on my profile) would be supremely helpful. Thank you!
",1752598944.0,MBA,Business
1m06l47,LBS or INSEAD MBA as a US citizen,Wondering what the experience and ROI on these schools is for a US citizen. I’d be pretty happy to stay working in Europe if possible given better work life balance and even though lower pay,1752548101.0,MBA,Business
1m0qkn8,Tier 3 college mba,So I currently started my mba from a tier 3 college. I know that i shouldn't but i have my reasons. But the question isn't is it good or bad the question is what exactly i could do to make the most out of my mba,1752606193.0,MBA,Business
1m0kkv7,How much does your B-school tier actually affect your long-term career growth?,"Hi everyone,

I'm a fresher from India preparing for CAT this year(2nd attempt). Like many aspirants, my initial goal was to get into a top-tier B-school. But lately, the stress has been intense. Between competitive prep, mental health struggles, and a constant fear of underperforming, I’ve been asking myself:

What if I don’t make it to a top 10 IIM? Is it really the end of the road for a good career?

I’m curious about the real difference in long-term career trajectory between Tier 1 B-schools and Tier 2 or Tier 3 


1)Do grads from mid-tier colleges really end up stuck in low-paying or average jobs long-term?
2) Is there actual career growth over 5–10 years, or does the B-school tag define everything?
3) Are the differences in network and opportunity gap impossible to bridge later?

I’m not aiming for below-average schools, but wondering if being in the top 50–75 is still worth it, or if it's better to explore other paths like Analytics/Marketing roles, or work experience + GMAT later.

Would love to hear from folks who've gone through any of these paths especially if you've made peace with not getting into the top 10 but still built a fulfilling career.
My profile - 9/9/9, national level Karate player, no experience BCA fresher.
Thanks for reading.

",1752592789.0,MBA,Business
1lzvnmo,WL at Multiple T10s. What are my chances this late in the game?,"Long-time lurker, first-time poster.

I’m currently on the waitlist at three T10 MBA programs with no other acceptances. I’ve submitted updates to all three, including a GRE retake and professional news. One school responded positively, the others have been silent. I’m domestic and live close to two of the programs, so I’d be ready to move quickly if given the chance.

That said, we’re now halfway through July and I’ve seen very little WL movement on Live Wire or other forums. Starting to wonder:

-Has anyone actually heard anything lately?
-Are schools holding spots open for visa-uncertain international students?
-At what point do I give up and pivot?

Any insight or shared experiences would help. Just trying to figure out if there’s still a shot; or if I should focus my energy on re-applying in R1. 
",1752520590.0,MBA,Business
1m046q0,MBA LORs (M7),"hi all, I’ve heard mixed reviews on the best people to choose to write your letters of recommendations. It seems like we should select colleagues/managers etc as opposed to undergrad professors/connections, which I completely understand because they want to get to know who you are as a professional; however, I feel as though working remotely for majority of my professional career hasn’t really allowed me to deeply connect with my professional connections, as much as I would like, to feel confident that their LORs would capture who I really am as an employee and as a person. So, I’m kind of stuck on whether I should take the risk with one of my LORs being written by a professor that I’ve kept a great relationship with that i know would write a great rec or select a colleague or manager that i don’t have much confidence in…What would you do? ",1752541318.0,MBA,Business
1m0moq0,Profile evaluation,"Started 7th semester, BTech in IT from tier 3 engineering college.

(According to board rule):

10th boards (ICSE): 89.2

12th boards (ISC): 94.5

College GPA: 7.6 (until 6th semester)

Co- founded coding club: 900+ members from different colleges. Activities included arranging workshops, webinars, coding competitions and public speaking.

Went to colleges to speak about open source development, git and github.

Internship at a Bangalore based startup: frontend development.

Unstop Igniters ideathon in college: 1st runner up, I was leading my team.

Participated in hackathons, didn’t win or get positions though.",1752597531.0,MBA,Business
1lzohbe,M7 Career Opportunities Worth It?,"Wanting to get opinions on a full time MBA. I know a lot of people have issues deciding because they currently make $150k+. I'm 25, making less than $75k, and having trouble transitioning from finance to consulting or tech if I could. Would an MBA make sense given my low salary and desire to make an industry change, or is the job market just bad right now.",1752504724.0,MBA,Business
1m0kya0,How much does your B-school tier actually affect your long-term career growth?,"Hi everyone,

I'm a fresher from India preparing for CAT this year(2nd attempt). Like many aspirants, my initial goal was to get into a top-tier B-school. But lately, the stress has been intense. Between competitive prep, mental health struggles, and a constant fear of underperforming, I’ve been asking myself:

What if I don’t make it to a top 10 IIM? Is it really the end of the road for a good career?

I’m curious about the real difference in long-term career trajectory between Tier 1 B-schools and Tier 2 or Tier 3 


1)Do grads from mid-tier colleges really end up stuck in low-paying or average jobs long-term?
2) Is there actual career growth over 5–10 years, or does the B-school tag define everything?
3) Are the differences in network and opportunity gap impossible to bridge later?

I’m not aiming for below-average schools, but wondering if being in the top 50–75 is still worth it, or if it's better to explore other paths like Analytics/Marketing roles, or work experience + GMAT later.

Would love to hear from folks who've gone through any of these paths especially if you've made peace with not getting into the top 10 but still built a fulfilling career.
My profile - 9/9/9, national level Karate player, no experience BCA fresher.
Thanks for reading.

",1752593643.0,MBA,Business
1m0i702,Can I get into IIM A B C/ISB/XLRI executive mba program with poor academic background?,"I scored 52 in maths in my 10+2. Then got 51.88%in Chemistry hons n overall (including all subjects) 49% in graduation from an average university. Then, I joined Regional rural bank n worked for 8 months. Then due to personal circumstances, after a long break I finally joined a psu bank as an officer at the age of 32. Now, I'm pursuing CFA. 
Is there any chance of me getting into IIM A B C /ISB/ XLRI ex mba given I score good in gmat?

",1752587148.0,MBA,Business
1m0ey0u,F1 International Student Visa,"Unable to find visa appointments in my country and have already quit my job assuming that I would be in school in a month. 

What should I do? Is it bad if I just end up taking this year a break/gap year?",1752577835.0,MBA,Business
1lyxmam,"I make $75k a year as a public school teacher in Queens, NYC and live just fine. People on this MBA sub are delusional to think $200k is ""bare minimum.""","Often times on this sub, you'll see people saying they'll not accept anything below $200k total comp in MBB, investment banking, or tech. My own older brother went to an M7 MBA (UChicago Booth) and works in finance, and to him, $200k coming out of grad school is ""low income.""

However, I'd like to offer a counterpoint. I'm in my mid 30s, and I only make $75k as a public school teacher. I live in Queens, NYC. I don't live in a bad area. And my quality of life is just fine.

First, I'm totally okay still living with roommates. If you find the right roommates, this can actually be fun. If you make low enough income like me, you can also quality for affordable housing or housing subsidies through NYC. This cuts down my housing costs quite a bit. But even before I got the affordable housing lottery, splitting costs with roommates in the outer boroughs made things affordable. 

Keep in mind roommates in your 30s are normal, even for higher income folks ($200k) in NYC and other VCHOL places like San Francisco. My own brother got into investment banking after his UChicago Booth MBA and lived with 2 other guys in Manhattan for a while. He did it because he found roommates to be fun and he could throw parties at his apartment. 

Second, I'm OK with not eating out a ton, maybe once or twice a month, and cooking at home the overwhelming amount of time. NYC has a lot of ""dollar pizza"" and inexpensive eateries too that make food work. I can also go out to bars once a week, I'll just have one beer or two. I'm past the age of wanting to drink a lot or do shots or get cocktails, the hangovers hurt. Or I'll just get a six pack from a liquor store and we'll pregame at home for cheap. 

I use public transit 100% of the time, so no need to own a car, pay for gas, maintenance, insurance etc. That cuts down on costs as well.

Third, plenty of social activities in NYC are free or low cost, or outdoors so you absolutely don't have to spend a ton to enjoy music, comedy, working out etc. I just take the subway to prospect or central park and job around over the gym and do weights at home. I'm also more of a home body and play video games in my apartment which takes up some social time. 

Having said this, I still have enough money saved up to go on trips, I can do one international trip for about 1.5 weeks a year. One year I went to Coachella with friends. Another year I did Disneyland. And I have my entire summer off where I can just chill, or do tutoring for supplemental income. Having summers off is such a godsend. 

I've been thinking of getting a Master's to increase my pay by $30k+, but even then I'd make max $100-125k living in NYC which is still low income to many of you guys. 

I also have no interest in having kids although I'd like to eventually get a husband one day. I feel comfortable with retirement by being on the pension system + Social Security. Tenure gives me good job security, it becomes difficult for me to arbitrarily lose my job. And the teachers union has my back. 

I'm single right now, but don't need an expensive or fancy wedding, a courthouse wedding is just fine. Don't feel a huge need to save up to buy a house either, I like living in NYC. 

Lots of higher income folks are opting to not have kids as well. 

So just as a PSA you don't need to make $200k minimum ""just to survive."" $75k even in NYC is totally fine.",1752425530.0,MBA,Business
1lzqtte,NYU PT MBA worth it?,"Hey everyone, curious on whether people think a PT MBA makes sense in my situation. I have 3 YOE in corporate finance and make roughly $130k in NYC.  I want to stay in corporate finance with my end goal being a CFO or Head of Finance type role - I have no interest in consulting or IB. 

NYU PT would be $170k with my employer covering $20k. I’m confident I could cover the $150k from current and future savings and not have to go into debt or pull from my 401k early. 

To me the ROI doesn’t seem to be there if I did a FT MBA as I’d exit into a FLDP role making $140k or so. The opportunity cost would be around $400k, which would only have an ROI if got an exec role (at that point just do an exec MBA if you’re at dir/vp level).

Question is simply - is there enough value in the stern PT MBA to justify the $170k sticker price?

Non target undergrad

Work for a $1-5b rev SaaS company

",1752510004.0,MBA,Business
1m0ba0t,I'm Back To Get My Resume Trashed - AGAIN!,"I've added my resume link here. Please go ahead and comment whatever you feel I need to do to improve it. I've removed actual names of my family business, will add them back in later. I really understood that my resume last time was trash, and I hope you guys will help me make it better, to have a shot at a good MBA this time around.",1752563985.0,MBA,Business
1lzt1o6,1Y MBA v/s 2Y MBA,"Hey guys,

* I am 30M with an Engineer undergrad from Chile and 5 years of work experience in the tech industry: (1 year SWE) + product manager (4 years) post that
* looking to move to the US now, and I understand that getting a good MBA is the best shot at finding job + building credibility in the US
* also - not looking to change the industry; want to continue being a PM in the same industry. Ideally at SF

Given this, I'm thinking that summer-internship is prob not necessary for me and I can save money / time doing a shorter MBA, giving my age and that I'm married, a 1 year program is really appealing to me.   
  
Have been going through the programs and find NYU Tech MBA and Kellog's 1 year (Kellogg confirmed that I am eligible) are suitable with good chance to find a job as a PM.

I'm thinking that if I do a 2-year MBA (given the cost of an extra year of university and not earning a salary), I need to get into the best university that will help me find the job I want, and I'm considering:

Berkeley Haas  
MIT Sloan

Would love guidance on 2 questions:

1. Am I in a good place to find a job without the internship?
2. Any other programs you would suggest? Specially 2Y programs? Haas and Sloan are extremely difficult to get in. (I have a GRE of: 167Q - 155V and GPA: 3.3)",1752514896.0,MBA,Business
