id,title,selftext,created_utc,subreddit,group
1jocjx7,Current Business School Admissions Round (r/MBA MegaThread),"Hello, please use this thread to discuss Applications, Interviews, Decisions, and any other general topics for the current/upcoming admissions round. 

Helpful Items to Include: 

Schools where you applied 

Stats (GRE/GMAT, Undergrad School Details/GPA) 

Work Experience Overview 

If you were asked to Interview? Accepted? Scholarship Info? 

Feel free to also share what your interest is post-MBA 

This thread will be re-posted every few months due to Reddit comment limits - it is auto-sorted by ""new"" but feel free to tailor it however you'd like to view it. 

[The previous thread(s) can be found here](https://www.reddit.com/r/MBA/comments/1eqnjyf/current_business_school_admissions_round_rmba/)

Best of luck to everyone!",1743451205.0,MBA,Business
1jocnja,MBA Job Market MegaThread,"Feel free to use this thread to discuss the MBA job market and the current business environment in general. 

It can also be for asking questions or career advice, sharing personal anecdotes, or discussing major news when it comes to business careers. 

This thread will be re-posted every few months due to Reddit comment limits - it is auto-sorted by ""top"" but feel free to tailor it however you'd like to view it. 

[The previous thread(s) can be found here](https://www.reddit.com/r/MBA/comments/1eqnqf6/mba_job_market_megathread/)",1743451440.0,MBA,Business
1m3mtam,"Fumbled career path, feel like I'm going in circles...","I started as an IB analyst at a BB out of a non targeting school, which was a hot start that I used to feel good amount before Covid. Absolutely grinded for 2 years, got an Associate offer but chose to go into PE. Did that for another couple years, realized I wasn't learning what I thought I would be, and now I'm at a T15 MBA recruiting for...IB associate roles. The same type of roles I could've taken three years ago...without spending $100k+ on tuition.

I'm networking harder than I did as an undergrad. I signed up for WSO courses to refresh some IB technicals, got LinkedIn sales navigator, RecruiterBase and IBContacts subscriptions. I'm literally cold emailing VPs like I'm 20 years old again. My PE experience barely matters because everyone wants to know ""why back to banking?"" and honestly what am I supposed to say... that I thought PE was the promised land but turns out I actually liked the deal flow and variety in IB better? Sometimes I lie in bed calculating where I'd be if I just stayed. VP in 2-3 years probably. No debt. Same exact job I'm recruiting for now except 2 years ahead and without blowing through my savings. Brutal musings....

Has anyone gone from IB analyst to PE then to MBA program only to land back as an Associate? Please DM me if so....",1752897924.0,MBA,Business
1m3ezim,UVA Darden no longer in partnership with Consortium,"Title.

I recently posted about something similar happening with UT Austin and Consortium. Therefore, I thought I’d share this news as well for any future applicants.",1752875231.0,MBA,Business
1m3cqkd,How to recover from social mistakes during MBA Year 1 at T15?,"A few months ago I finished my first year at a T15 MBA. I grew up with very strict Chinese tiger parents. I wasn’t allowed to hang out with friends or go to parties and spent all my time on school. All my childhood vacations were visited extended family in China. I studied engineering and became an engineer.

I came to business school to pivot into product management and also to finally learn how to make friends and be more social. My school has a small class size, and at first everyone was very welcoming. I'm skilled at making good first impressions: I'm physically fit and enjoy male fashion.

Over the year I made several mistakes that hurt my reputation. On one overnight trip, people were drinking, doing shrooms, and sharing ""vulnerable"" personal stories. Most shared stories about breakups or family arguments. I got too drunk and high and told a heavy story about my dad beating me, which made people uncomfortable. On another trip, I drank more than I could handle, passed out early, and didn’t help clean up the Airbnb or wash dishes the next morning. People were upset I didn’t contribute.

At a crab dinner, I didn’t know how to eat crab properly and made a big mess, splashing crab water on classmates. At a party someone handed me the Spotify and I played old beyonce and emnem because I don’t know much current music. People laughed and thought it was strange.

I also misread how close I was with people. After a few trips and late nights I assumed we were good friends, but they didn’t feel the same way. Someone eventually told me I was coming off as clingy and oversharing. Again, I've been a loner most of my life - those kinds of friendships are new to me.

The classmates who are still friendly are the ones who only see me at happy hours or in class. The ones who spent more time with me on trips seem to avoid me. I feel like I should stick to happy hours, have one drink, and keep conversations light instead of going on trips where people see more of my awkward side.

Career-wise I am doing fine. I have a PM internship and keep things professional at work. But I really wanted to use the MBA to improve socially too, and I feel like I totally messed that up.

For year two, should I just stay low-key, skip overnight trips, and focus on work while keeping it light at happy hours? Or is there a way to repair my reputation and keep trying socially.",1752869695.0,MBA,Business
1m3qimm,Online MBA suggestions?,,1752911244.0,MBA,Business
1m3sg9k,Wrote a Deep-Dive Blog on the Indian MBA Journey. Looking for Critical Feedback from the Community,"I’ve been part of the MBA prep grind for a while now, and recently I decided to put everything I’ve learned into one place from CAT prep to interviews, B-school life, and post-MBA placements in India.

It’s not a commercial piece or anything, just a personal effort to create something I wish I had when I started my journey.

Would love to get honest feedback from this community, especially from those who are going through it or have already completed their MBA.  
What do you think works? What’s missing? Anything you strongly disagree with?

Here’s the link if anyone’s up for a read:  
👉 [https://www.toughtongueai.com/blog/ultimate-mba-guide-india-2025/](https://www.toughtongueai.com/blog/ultimate-mba-guide-india-2025/)",1752918974.0,MBA,Business
1m3o4dt,Reaching out to current students/ grads from Kellogg,"Hello all,

I have tried reaching out to Kellogg grads via LinkedIn and have had limited responses. That is understandable given how packed their schedules are. 
If any Kellogg grads or current students are willing to connect please dm me. 
I am also okay with just connecting over text as I realise how packed your schedules are right now. 
Any help is appreciated!
",1752902355.0,MBA,Business
1m3nhs4,Considering deferred mba (nontrad),"Hey y’all — I’m a poli sci major at a top 20 LAC (3.65+ GPA anticipated) looking into deferred MBA programs. My background’s a mix of finance + political comms:
- summer analyst at a large global bank 
- policy content intern for an influential figure of the progressive left. 
- data consulting for large natural civic org
- college consulting intern
- digital comms internships w/ U.S. Rep, U.S. Senator 
- Lots of music/art stuff (punk band frontman, classical piano award, chamber music, choir, composition award, etc.)

Also: study abroad in Italy, leadership on PA ballot initiative, radio host, etc.

Targeting: consulting or finance out of undergrad to pay off that debt, then long-term social impact/public-private strategy work.

I have not even thought about studying for the GMAT but I’m not sure if this is something I should consider yet. Are these types of programs for me? I feel like with a return offer on hand with this bank assuming I just work there for a while I don’t know if my profile later will differ too much. I’m from PA and NYC is a dream so… def applying to Penn/Columbia, + I like Chicago so thinking about Booth and Kellogg as well. Probably also Harvard cuz why not

Which programs feel like a good match? Ik there’s only so much I can say w/o GMAT but yeah appreciate feedback ",1752900188.0,MBA,Business
1m3qf66,Considering an MBA in Finance in Dubai — Looking for Recommendations & Insights,,1752910884.0,MBA,Business
1m3hudn,Best system for organizing notes and documents during MBA?,"Hey everyone!

I'm an incoming MBA student (starting this fall) and wanted to get your advice on the best way to organize all the case notes, decks, and readings we’ll be going through.

For context:

* I don’t use an iPad or take notes by hand anymore. (But would be open to get an iPad if it is trully the best way to take notes)
* I previously did a master’s in Europe straight out of undergrad, and looking back, I regret not having saved any of my notes, cases, or insights from that program. This time, I want to build a system that I can actually come back to after graduation and find useful.

Right now, I’m looking advice on two different things:

* **Apps like Notion, OneNote, or Evernote** for digital notes. I’ve tried using Notion in the past as a “personal brain” but never fully adopted it, possibly because I didn’t know how to use it well.
* **Storage System (like OneDrive)** to save cases, PDFs, PowerPoints, etc. I was thinking of creating folders by course, but the challenge is that notes would be separate from the readings unless I manually link them (not a dealbreaker, just a nice-to-have).

Would love to hear:

* What systems or workflows worked for you during your MBA?
* Any tips on how to actually make something like Notion stick?
* If you use a combo of tools (e.g., OneNote + Drive), how do you organize it?

Goal is to not lose track of valuable insights and material like I did in the past. Thanks in advance!",1752882799.0,MBA,Business
1m32jqx,Returning to MBB after MBA,"I have to commit to a deferred MBA program in the next couple weeks. However, I'll probably only attend these programs if they're sponsored by my employer (MBB). Because of that, I'll to return to MBB for a couple years after I graduate.

I feel like this changes the calculus of my decision as I won't be actively recruiting during my MBA, but I don't know exactly how. I'm curious how other people who got sponsorship decided where to go to school or if anyone has insight as to how to decide on a school when you won't be leveraging most if its benefits for 2+ years post-graduation.

TLDR: What should I base my MBA decision off of if I'm returning back to my previous employer after graduation.",1752845824.0,MBA,Business
1m3izb5,How can I prepare myself for a top program,"Hello all,

I just graduated college a few weeks ago majoring in Economics and Computer Science. I got a job in corporate finance (Financial Analyst). Nothing fancy but the company is Cummins Inc. (so there is room for growth). I really want to get into a top 10 MBA programs in 3 years. In the meantime, I  want to stay at Cummins and get as much professional experience as possible. My questions are:

- How do I prepare myself for a top program during those 3 years. What would be the most ideal timeline and path?

- One of my dreams was to get into investment banking, but honestly, after an mba, I was hoping this would open more doors within corporate finance and climb the corporate ladder within my company. So my question would basically be: Is investment banking reachable after this, and how common is this path? Or, should I decide to return to my company and seek better roles, what are my growth prospects and salary jumps?",1752886073.0,MBA,Business
1m3646m,Should I go PT (Online) or FT if I currently make 175k and work in Cybersecurity? (Unique Situation),"Hello everyone, I've been lurking here for the past few months but can't nail down an answer for myself as I have a very unique situation (I can pretty much go to any B-School for free). Here's some background:

I am Hispanic, 26, have worked for the last 9 years, 6 of which was in the military. I have tons of leadership experience, Non-Commissioned Officer in Charge of many projects and programs within our Brigade, Was the NCOIC working Clandestine operations living in Eastern Europe and South America for about 5 years (tons of dad lore, beer, and nicotine). Currently working in GRC and Auditing as I have switched to the blue side cyber life.

I used to work in Military Intelligence where I had a strong red team cyber background. I am now 100% Permanently/Totally Disabled and have a ton of benefits that may help my career which I would like to take advantage of. Particularly I have the G.I. Bill **AND** a one time student loan forgiveness (up to 133k or 250k for Ivey I believe). 

I graduated with my B.S. Computer Networks and Cybersecurity with a GPA of 3.67 and will graduate with a M.S. in Cybersecurity Management and Policy this December, both are from a no name school. I have not taken the GRE or GMAT yet as I am planning to apply for schools for next Fall (I'll be 27 by then).

All in all, with my salary, disability pay, and G.I. bill money I am making a little over 175k living in a big city in Texas (cost of living is relatively low).

The question is, do I have the background for a HSW or M7 program and should I shoot for the stars since I pretty much have a full ride anywhere I go, giving up 220k of income for 2 years? Or should I play it safe and complete a part-time online MBA like Kelley while stacking up cash? This is difficult for me since I have never had this much money or have felt this much peace in my life (I am first generation and we didn't have any money growing up). The sweet spot would be marrying my technical background with the MBA in some way but I still need to research what that looks like or if they're are any MBA programs geared that direction.

I also realize that it would be a waste to not take advantage of the opportunity for myself and my future family, I do everything for my kids that don't even exist yet. I feel as if a top school could give me access to a network and opportunities that could set my future kids and their kids up as well.

All perspectives would be appreciated. I ***feel*** its my duty to try to get into a top school, but my ***brain thinks*** the money makes more sense.",1752854234.0,MBA,Business
1m3dmdy,IB or Consulting for a career change into ER/AM,"I’m looking at attending a M7/T15. I have a strong desire to land an ER/AM role in the future. As much as I’d love to swing these roles post-MBA I don’t want to limit myself in the recruiting cycle since I understand these roles are ultra-competitive straight out of school especially for someone with my background (Engineer).

I decided to pursue either Consulting or Banking post-MBA. Which career will better for opening opportunities in ER/Public Markets Investing down the road? I understand IB gives you the “finance” pedigree but I’ve heard switching into from IB -> ER is difficult??",1752871852.0,MBA,Business
1m38yz9,What do the international MBA candidates intend to do with companies downsizing their workforce and screening out candidates with work visa requirements?,"Between bets on AI and the current administration corporate America is going to be a blood bath for the foreseeable future. 

My COO just asked me to rescind two job offers to recent graduates as we cannot even offer OPT anymore. 



",1752860788.0,MBA,Business
1m3m99v,Should I consider deferred MBA ?,"Hi everyone,

I’m currently a college senior majoring in Mechanical Engineering at a Top 5 engineering school. I’ve been fortunate to receive sponsorship from a Top 10 company for my undergraduate studies, and I’ve completed internships with them as well. I plan to go back and work with them for couple years as well. 

In addition, I have some entrepreneurial experience, including participating in and winning a startup/case competition. While the name of the project sounds fancy, I’d describe it as a relatively simple business idea executed well.

My GPA is 3.9/4.0, and I’m genuinely interested in pursuing a deferred MBA after graduation.

Given this background, how competitive do you think I am for top deferred MBA programs like Stanford GSB or HBS 2+2? Any advice or feedback is appreciated!",1752896101.0,MBA,Business
1m36vwk,How Much Does Your Pre-MBA Job Matter?,"I was laid off two months ago from a research lab job doing something that many would consider highly-specific and niche. It was also quite technical. My undergraduate studies were in business psychology and entrepreneurship. I pivoted to becoming a postbaccalaureate pre-med after I graduated from undergrad due to a push from my loved ones to become a doctor and my strong interest in the sciences. After getting laid off recently, I’ve made the decision to leave the pre-med path as it has been a consistently not-so-great experience for me over the past three years. I will also withdraw from my program. 

I have internships, part-time work, and volunteer work all at startups and medical/clinical/hospital settings. My research job was my first full-time job which I did for nearly three years. I have my story and reasoning laid out for why I want to pursue an MBA (in healthcare/pharmaceuticals), but I haven’t found a new job yet and I will be applying this cycle. 

I’ve been applying to financial analyst, investment banking analyst and business analyst roles that require 0-1 years of previous experience and I have not heard back. Some have been in healthcare investment banking. I have no idea what I’m doing wrong but I was hoping to have a more aligned, MBA-specific job during the year before I start a program. It also would have been great to add the role to my resume. I’m feeling a little lost about this. I’ve called an MBA program to ask admissions and they told me that I should pursue what interests me and that they do not look for specific jobs from applicants (very broad, very vague, which I understand). 

A few questions. Feel free to answer any:

Should I just get an un-aligned job in whatever field that interests me, even if it isn’t in research?
Or should I keep pushing ahead and applying to analyst roles? 
Does your most immediate role prior to applying to an MBA program matter? 
If you had non-business or finance roles prior to applying, how did you fair? 

For context:
I’m a 29F and one of the schools was an ivy, the other was a “top school”. 

Thanks!",1752856023.0,MBA,Business
1m36s0o,Wharton Waitlist,"Is anyone still waiting on the Wharton MBA waitlist? Just curious haha

Wondering if there's any chance still at this piont. ",1752855767.0,MBA,Business
1m3954x,"When you’re recruiting, do firms care if you’re working part time? What about with a competitor? Internships?","I’ve accepted an offer to stay on at a limited, part time basis with my B4 accounting job. 20 hours a week, remote, on my own schedule- in exchange for about $60k a year and full benefits. Going to give it a try and can always quit if I need to. 

One thing that I’m thinking about, though, is what it would look like during recruitment. Is it going to be a red flag that I’m working part time in general? Is this something I should / have to disclose? On the flip side, would this be seen as interesting or a good bullet point on my resume? 

In particular, let’s say I recruit for MBB which compete with my firm in consulting. Is there going to be an issue? 

What about summer internships - would there be a problem with me taking an official sabattical while I work an internship? I imagine this has to be similar to sponsored students doing an internship at another company over the summer. 

If I get an offer, will they care if I continue to work part time elsewhere? ",1752861193.0,MBA,Business
1m38qoc,WHICH MBA program would you go with UNC with a little money or UGA with full ride and scholarship,Which one would you choose UNC MBA with around 75K a year total cost with scholarship or UGA MBA (both full time) with full ride and 20K scholarship,1752860257.0,MBA,Business
1m3fvnx,Where does good product management happen?,"Mediocre product managers are a dime-a-dozen (sorry but it’s true). What companies and firms tend to have functional, good product management organizations, and how can a prospective student vet companies’ product management from the outside? 

Company suggestions don’t have to only be big firms—I’m open to all sizes.",1752877526.0,MBA,Business
1m3e1l4,Texas Online: UTD or Baylor?,"I work full-time in Dallas and can’t afford to pause work and move out for a full-time program like UT. I was accepted to SMU, UTD, and Baylor’s online MBA programs.

For SMU, I struggled to justify the cost honestly 🥲

UTD and Baylor’s programs are both fully online and cost about the same

For future job opportunities, is the Baylor name enough take me further? Or would being local to Dallas and closer to UTD benefit me more?

Im early in my career, liberal arts background but ~3 years in a management role. I see myself continuing in management/sales/customer success/account management in any industry

I want a high salary and growth ofc but I can’t justify a 6-figure degree for myself, so im looking for best value for my money
",1752872881.0,MBA,Business
1m2u4jq,USC Online MBA - is 132k tuition worth it? i have to decide tomorrow!,"Hi!!! i applied last minute to the USC Online MBA program not expecting anything but i got accepeted! i gasped when i saw that the tuition is 132k!!! anyway, i only have 5 years of experience in sales/fulfuillment/supplychain in beauty industry (like Summer Fridays and Henkel). i have never been a manager before. I want to break into the entertainment industry or some type of a merketing role or honestly just climb the ladder in my current field. would it be worth it? is the connections and network USC allows you to have is really that good? PLEASE HELP ME DECIDE!",1752817017.0,MBA,Business
1m3c07q,Post MBA options,"Hi guys, a short question, looking for opinions or experiences. If I were to do 2-3 years in a bulge bracket bank capital markets middle office, would a good MBA degree afterwards give me the possibility to interview for IB with no prior IB experience? Would it be enough to get interviews for entry level positions?",1752867924.0,MBA,Business
1m31edg,155 EA — Should I apply R1 to Top Schools or Focus on the GRE?,"Hey everyone,

Would love some honest input on my situation. I recently took the EA for the 3rd time and scored a 155 (Q14, V10, IR11). It’s not a perfect score, but I hit the “12+ Quant & 155+” combo that many consultants and schools say is the general threshold for full-time MBA programs that accept the EA. (Option of retaking the EA is out, I want to leave the 4th attempt for potential EMBA in the future).

I’m targeting Columbia, NYU, Darden, and Duke if I go the EA route. I received the feedback from some consultants that I should go all in on Round 1 apps with the EA and just focus on executing the rest of my application really well.

That said, I’ve heard (especially about Columbia and NYU) that while 155 is the unofficial minimum, schools may prefer to see something closer to 158+. And I know the EA isn’t viewed as strongly as the GRE/GMAT at some schools. So I’m worried that 155 might not be enough at the top programs.

I did take the GRE this year and after a few attempts my highest score is in low teens. I think if I put in focused effort in the next 1-2 months, I could potentially get to the 320–322 range. But that would probably mean pushing my apps to Round 2, which obviously carries more risk and getting 320+ is not guaranteed either. 

So here’s my question:
Should I go ahead and apply with 155 EA or postpone the applications to Round 2 and improve the GRE score? 

For context, I’m an Eastern European applicant with 3.3 GPA from the PAC-12 school and a strong professional background (finance + former pro athlete).

Thanks in advance and appreciate any thoughts
! ",1752842788.0,MBA,Business
1m37km9,INSEAD Scholarship Advice,"Hi everyone! I am very greatful to have received an offer of admission for INSEAD 26D graduating class! With that being said, I just found out I have only received a 20k Euro scholarship which is a little bit less than what I was hoping for. Hoping to receive some advice on if it is smart to pursue this MBA with a large personal loan considering todays economy or risk applying to US schools instead with hopes of a bigger scholarship (top 20 schools)? Ideally, I hope to work in either the Middle East or US.

My stats are as follows:

•	⁠27M; Canadian (Born in Asia but lived entire life in Canada)
•	⁠740 GMAT; 3.3 GPA Chem Eng bachelors
•	⁠4 years work exp at matriculation with 3 years in nuclear engineering
•	⁠Hoping to pivot towards strategy consulting specializing in sustainability, building off of my work in sustainability focused roles but hoping for less technical and more strategy side.

Would love and appreciate any and all advice as I am at an interesting crossroad at this point in my career! ",1752857633.0,MBA,Business
