id,title,selftext,created_utc,subreddit,group
1m2vdvr,Profile Review & Path Advice: 35M Indian Entrepreneur | 680 GMAT | 5-Yr Unemployed | Low GPA | MBA vs. Job?,"Hi r/MBA,

I'm at a major crossroads and would be incredibly grateful for this community's honest feedback. I've spent the last several years on a transformative personal journey and am now deciding between pursuing a top MBA or trying to pivot directly into a corporate marketing role.

PROFILE SNAPSHOT

* Demographics: 35-year-old Male, Indian
* Stats:
   * GMAT: 680 (Q48, V35)
   * Undergrad: M.Sc.(Tech.) from BITS Pilani (Low GPA - context provided below)
* Work Experience:
   * 9 years total.
   * 2 years as a Manual Test Engineer at an IT firm.
   * \~7 years as a creative entrepreneur (founder of a successful photography/videography business with international clients).
   * Current Status: Unemployed for the past 5 years (context provided below).
* Post-MBA Goals: A leadership role at the intersection of Marketing, Strategy, and Data Analytics, targeting the tech or CPG industries.
* Target Schools: A mix of US (Kellogg, UCLA, Vanderbilt), Canadian (Rotman), and European (ESMT, INSEAD) programs.

BACKGROUND & STORY

* The ""Why"" Behind the Low GPA & Early Career: My low undergrad GPA is a direct result of a significant personal trauma (the loss of my mother) and a difficult family environment that shattered my self-esteem. My early career as a creative entrepreneur was successful, but I knew my foundation was built on intuition and hustle, not on a solid strategic or analytical framework.
* The 5-Year Employment Gap & The ""Comeback"": I recognized I needed to rebuild myself from the ground up. I made a difficult and unconventional decision: I stepped away from my career entirely five years ago to dedicate myself full-time to a complete personal and professional reconstruction. This period culminated in a 3.5-year, all-consuming journey to conquer the GMAT. For me, this wasn't just part-time study; it was my full-time job to rebuild my analytical foundation, overcome my past academic insecurities, and prove my capabilities. The 680 score is the result of that unwavering, single-minded focus.

MY DILEMMA & QUESTIONS FOR THE COMMUNITY

My core dilemma is this: Is the massive investment of time and money for a top MBA the right next step, or should I try to re-enter the workforce directly in a marketing role?

I would be grateful for your thoughts on these specific questions:

1. The Employment Gap: How will admissions committees view a 5-year employment gap, even when it is explained by this full-time, transformative GMAT journey? Is this seen as a major red flag, or as a compelling sign of commitment and resilience?
2. Profile Perception: With the added complexity of the employment gap, how will T15-T25 US or top European schools likely view my profile? Is the story strong enough to overcome the combined hurdles of a low GPA and a long period of unemployment?
3. Path Viability (MBA vs. Job): Is the MBA now the only realistic path for me to successfully re-enter the workforce at a high level? How difficult would it be to get a good marketing job directly after a 5-year break?

Thank you in advance for your time and any insights you can share. It means a lot.",1752821651.0,MBA,Business
1m1w9of,Is a $10K online MBA from a lesser-known university worth it to help me move from Production Manager ($150K) to Plant Manager ($200K+)?,"I'm 34 with an undergrad in engineering, currently working as a production manager making $150K. I'm geographically limited for now, but long-term I want to position myself for a Plant Manager or similar role targeting $200K+.

There's an online MBA program from Eastern University that costs only $10K total. It's not a top-tier or well-known school, but it's affordable and flexible.

Would completing this program be worth it to help me move up, or would I be better off focusing on certifications (like Lean Six Sigma Black Belt) or executive education courses from more reputable schools?",1752720510.0,MBA,Business
1m1fm8s,"M7 MBA grad, landed a PM offer at Oracle (OCI), but Classmates are discouraging me saying oracle is a ""dinosaur"" Dying Firm, but the job seems great?","Hey, I'm an M7 grad who didn't land a full-time role during my 2nd year but finally got a Product Manager offer at Oracle (OCI). 

The role itself is really sweet, it's around $200k in total compensation, which is what I'm looking for, and it's in the OCI (Oracle Cloud Infrastructure) division. 

However, some of my M7 classmates haven't been impressed. They did congratulate me for landing the role, but they said Oracle is a dinosaur, dying company. That it's legacy tech similar to IBM and doesn't have a great reputation in the tech industry.

However, from what I've seen, OCI itself is pretty good? Also since June, there's been 32% jump in Oracle’s stock price to an all-time high, after the company reported better than expected quarterly revenue and profits on June. 

Larry Ellison is now the 2nd richest person in the world, behind Elon Musk, but above people you'd think would be higher like Mark Zuckerberg, Jeff Bezos, Warren Buffett, Larry Page, Jensen Huang etc. 

My classmates said I should take the job but try to recruit for a better company like FAANG and jump ship. They're treating Oracle like a WITCH company.

Are they just jealous? This seems like a pretty awesome role tbh.",1752679734.0,MBA,Business
1m2ihrp,What experience I can get after B.A English if I wanna go for a mba ?,"My_qualifications 
If I wanna do an MBA,  how can I get dome work experience when I my graduation is in a different subject ?",1752784309.0,MBA,Business
1m1tvpj,How to spend the first 6 months of MBA,"Female 28, international, incoming HBS MBA. 

As we get closer to the start date of school (8/25), lately I’m just experiencing a lot of different emotions. I can already see how much I will struggle in the first 6 months. Adjusting to a new city and location (btw I come from a warm region and I absolutely hate the cold), finding a new circle of friends, being overwhelmed with all sorts of information, extreme pressure from recruiting, and FOMO. I went to a top undergrad school in the US and at my age, really not in the mood of going through intense peer pressure once again. I will also split paths with my current boyfriend due to extreme long distance. I don’t want to lose him, but we both sense a potential break up down the line cause the feasibility of keeping that relationship is too low (I will likely wanna recruit for the US market). So I will need at least 3 months to mourn for that relationship loss. When looking ahead I’m just like - that’s really a lot. 

I don’t think by planning I can avoid any of the difficult feelings during the initial adjustment period, but I’m keen to hear other people’s experiences during their first 6 months and what sort of mentality helped you make that initial adjustment. 
",1752713678.0,MBA,Business
1m29gkd,Consulting Prep: Looking to split for Crafting Cases Analytics Course,"Hey folks. I'm preparing for Consulting Interviews and I'm looking for people to split the cost for the Crafting Cases Analytics Course ($297).

https://students.craftingcases.com/courses/analytics-academy?utm_source=cif&utm_medium=in_cif_pdf

Looking for at least 5 people to split with. Kindly DM if interested!",1752763556.0,MBA,Business
1m27i3c,Any recommendations for pre-mba coursework? Similar to Harvard core perhaps?,"Title says it all. Just looking to do a refresher of things that would be helpful for prepping for an mba. I’m older and it’s been a while since I did college math of any type. Not trying to spend a fortune. Would like some Sort of certificate to say hey I did this to show admissions. 

Curious what others may have done or heard about. My undergrad was not mathematically very heavy so I’d like to bolster an application with this as well. Or so that’s my thought. ",1752758772.0,MBA,Business
1m1w6up,"If I’m not interested in PE, consulting, or IB, would an MBA still be worthwhile?","I come from STEM and have been working in a minor financial role. I’m hoping to pivot into an actual finance role though. My concern is MBAs aren’t cheap, and everyone on here seems to focus on PE, IB, or consulting which don’t interest me. I think FP&A, tech, or internal strategy are more my interests. Would an MBA help me make that pivot? Or should I look at an MsF, or maybe a certification like a CPA? Not finding much luck with Google or ChatGPT on this.",1752720278.0,MBA,Business
1m1fpru,Wharton MBA Essays are out,"The most anticipated debut of the season is finally here. Ta-da:

**Essay 1: Two short-form questions**

* What is your immediate post-MBA professional goal? (50 words)
* What are your career goals for the first three to five years after completing your MBA, and how will those build towards your long-term professional goals? (150 words)

**Essay 2: Long-form essay**

* Taking into consideration your background – personal, professional, and/or academic – how do you plan to make specific, meaningful contributions to the Wharton community? (400 words)

I'll add some thoughts on approach later but having seen a post about this just minutes ago, wanted to share the news.

P.S. A more important change to me is that now, **there's only one required LOR and it's the GMAC Common one.** ",1752679959.0,MBA,Business
1m28vrk,Pre/Post MBA Experience Info,"I see A LOT of people here talk about their salaries pre and post MBA. I would love for anyone to give more specifics on their experience. What I mean is this: what was your job title before you got your MBA and was is your current job title? How long after your MBA did you switch jobs? What was your salary before and after? How did you go about getting said new job i.e. did you just apply randomly to jobs, did you stay within your company, did you already have a contact about a potential job opening before you graduated, how did your abulity to interview for jobs change, etc, etc......

All of this information would be really helpful for me. I have my undergrad in Economics and I am looking to get into the finance/investing world with MBA. But with how unsuccessful I have been in this attempt with just my undergrad degree, I'm honestly pretty skeptical that I'll be in a position to get a better paying job. ",1752762174.0,MBA,Business
1m28vpi,Predict,"What aspect of the MBA education skill set /concentration will be obsolete/minimized in five/8 years due to
AI being utilized by the best funded organizations?
",1752762171.0,MBA,Business
1m28asw,Targeting consulting gigs,"Hello All,

I am an incoming international student at one of the T15s.

I want to break into consulting and I’m wondering what are the firms that sponsor international students? 

Specifically, do these firms sponsor? 
AlixPartners, Accenture Strategy, Alvarez and Marsal, Oliver Wyman.

Is it safe to assume all these above mentioned companies would visit all T15 schools? 

",1752760796.0,MBA,Business
1m2870a,Tepper $$ vs CBS vs Kellogg,"31M in tech, i have worked the past 8 years in big tech. I have a cs undergrad from a no name public school. From what I’ve heard prestige is super important for an mba.

I got into Tepper (40k scholarship), CBS (no scholarship, have to pay out of pocket) and Kellogg (no scholarship, have to pay out of pocket).

I have 2 kids and don't mind relocating for a bit with the family. Curious to hear what you think.

My goal is to transition to PM and get involved with search funds. What would you pick?",1752760529.0,MBA,Business
1m27mq8,Part Time MBA Help,"Firstly thank you for taking the time to look at this post and for any assistance. I am looking to apply to NYU Stern's Part-time MBA program, it would be fully covered under my works tuition benefit policy. I currently work for NYU Langone and my department vice-president has agreed to write me a letter of recommendation. I have been working for 4 years, 2 of them at my current place of work. My concern is that my undergrad GPA is low, with me graduating with a 2.89 due to familial issues with my father becoming sick, this lead to me requiring to be hands on in his care and assistance with doctors appointments especially during the pandemic. I understand its too late for me to go back and change my GPA, however I was able to score a 334 on my GRE but I've read that due to my GPA I would be screened out immediately, but I'm not sure if that also applies for the PT program or just the FT program. If anyone has any feedback that would be greatly appreciated. Additionally, I'm not sure how important this is but I have seen it in other threads but I am a US citizen and wouldn't require a visa or anything. Thank you again.",1752759098.0,MBA,Business
1m26ra5,How to maximise a 1 Year MBA,"Hi all , I’m about to start a 1-year MBA in the UK and would love your advice on how to make the most of it!

I’m hoping to:
-Join a few student clubs
AMaybe run for a leadership role or join a committee
-Prep for consulting or PE internships (career pivot!)
AStill have time to network, attend events, and not burn out 😅

For those who’ve done a 1-year MBA or are currently in one:
-What would you prioritise early on?
-Is it worth running for leadership roles or too much of a time sink?
-Any tips on juggling case prep + internship apps + life?
-What do you wish you did more or less of?

Female/international perspectives especially appreciated, but all advice welcome. Thanks! 🙏
",1752756807.0,MBA,Business
1m2bty2,MBA Consultant Recommendations Required Urgently,"Hi, I'm looking for consultant recommendations for ISB (and potentially European schools - HEC, Insead, LBS). I have a bit of a complicated story and would need personal touch for them to understand and provide guidance. Might put a profile evaluation post here in the coming days.

I have looked into Admit Expert, but the reviews all over reddit for them seem fake, and the only seemingly genuine one's are bad. I'm trying to contact Admit Street but I don't know when they will respond. Tried Dream School Admit (Arvind), but he said they're currently full. 

If someone has taken the help of a consultant for ISB and other European schools, please let me know which consultants you would recommend! I am looking to have a definitive answer by the weekend so am trying to make some haste in my research, please do help me if you have some experience in this area. Thanks!",1752768971.0,MBA,Business
1m2i6tc,MBA Straight After Undergrad?,"Hi all,

I currently attend a non target school in the US and want to break into high finance post grad (IB, PE, HF, VC, etc.).  I was thinking that due to my low tier school status and having missed recruiting cycles for internships due to originally being a computer science major, that I probably need an MBA to do what I want to do. I was hoping to get some feedback from others on whether it would be worth it to go straight from undergrad to MBA if I know what I want to do will likely require it.

I would be open to doing full time mba in the US or the EU (English speaking courses). 

My stats are: 3.4 GPA, 3.7 in major GPA, 1 IT internship (when CS major), 1 business development internship. Even though I’m at a very much non target, I am on a prestigious academic scholarship. I am joining the student asset management club next semester and am involved in financial planning club. Also have many volunteer hours and extra curricular’s (like soccer, basketball, etc). 

Also, if anyone could maybe chance me for some of the popular mba programs that’d be great. I’m obviously not expecting to get into an ivy or anything, but some of the top EU schools and upper middle tier schools in the US (Darden, Fuqua, Keenan-Flagler, Goizueta) sound appealing.

If you’ve read this far, thank you for any help.

Edit: Forgot to mention that my major is Business Administration & Data Analysis, with a double concentration in Economics and Finance.",1752783609.0,MBA,Business
1m2gdwk,Acca vs Mba ?? What's some other options to get a job abroad that's not related to STEM field ??,"From india 
12th 66% commerce
20f currently doing a B.A in English. 
I want to do something else after graduating. 
Was planning to write Gmat and get some work experiences and do mba maybe but a part of me don't wanna spend soo much money on it and also idk if mba is for me or not , I think I can adapt to it cause I want a job abroad. 

But it's easier and less stressful option. 

A part of me thinks I want to increase my competency and don't like get good job cause I was lucky enough to study abroad cause I'm kinda insecure abt my academics cause I'm average rn and didn't score much on 12th .

I don't know if accounting is for me , I feel like a manager role would be better.
I Don't wanna take up Acca and then struggle to pass it either .
Idk if I can manage accountancy , I didn't study much in 11th nd 12thh and just studied some easy questions to pass accountancy. 


I don't wanna get depressed but a part of me thinks I should finish my education and get a job abroad instead of spending money to study there cause what if for some reason I can't finish the degree and waste all that money .
But I also saw its difficult to get job abroad for acca just after studies..

What are some other job options ?
",1752779401.0,MBA,Business
1m23rct,[Offer] GMAT FE Course – 2 Months Access at Discounted Rate,"Hi all! I’m offering a 2-month Magoosh GMAT course at a discounted rate. The account has been completely reset, so it’s good as new, full access to all features.

Perfect if you’re looking for quality prep without breaking the bank.

DM me if you’re interested!",1752747282.0,MBA,Business
1m26pq7,Want to sell my unacademy iconic subscription for CAt and other MBA related exams valid till May 2026,"Prices are low
Dm if interested ",1752756693.0,MBA,Business
1m22h44,Application Predictions,"With the current political climate, it sounds like the number of international students will decrease, yet with signs of a recession, applications might increase. It begs the question, is now the best time to get into a Top-Tier MBA program?

[View Poll](https://www.reddit.com/poll/1m22h44)",1752742358.0,MBA,Business
1m1n1eg,Is GPA make-or-break for top schools?,"I have below 3.0 GPA from uni, but I also have 7 YOE in engineering and expert positions in two different industries. I want my MBA to be worth it, thus my desire for top schools. Should I give it a go or not even bother at all? I don’t want to spend months to get a 700+ GMAT score only to get rejected from my dream schools, yk. Is it worth it to get an MBA even if it’s not from the best ones?

I’m also looking for ways to launch a SaaS. Kinda lost at this point in my career, so I’d appreciate any feedback. Thanks!",1752696372.0,MBA,Business
1m21l1m,Cambridge MBA at 28 vs warwick online MBA at 27 - for UAE based senior tech professional aiming for own startup or a 45 k pm job not in consulting,"Hi all,

I’m a 26-year-old based in the UAE, currently earning 20,000 AED/month in a senior tech role. I’m aiming to transition into a product manager or strategy role earning 40–45k AED/month in the next few years. Eventually, I want to build my own startup, not chase MBB or VC jobs.

📈 Career Path I’m Considering:
	•	At 27: Do Warwick’s Online MBA (while continuing to work in UAE)
	•	At 28: Apply for Cambridge MBA (full-time) — if I get a scholarship, it’s within my budget. Oxford is out of reach financially.

The total cost difference between Warwick Online MBA and Cambridge MBA is about 1 crore INR (~$120,000 USD) when you include opportunity cost.

By the time I’m done with either MBA, I aim to be earning 40-45k AED/month, or building my own company.

⸻

💭 My Key Questions:
	1.	Will a Warwick Online MBA at 27 be enough to make the transition to product/strategy or support a future startup?
	2.	Is the 1 crore INR cost difference worth it for a Cambridge MBA at 28, even if I’m not aiming for MBB or VC?
	3.	If I self-learn PM, AI, BlockChain and startup skills and reach 30k/month by 27, do I even need an MBA?
	4.	For someone already in UAE, does network and prestige of Cambridge significantly open doors compared to Warwick Online?

⸻

Any honest input, especially from those in UAE or who’ve taken either path, would be amazing.

Thanks in advance!
",1752738868.0,MBA,Business
1m217mj,International student considering MBA with Supply Chain/Operations focus — What are the job chances without experience?,"Hey everyone,

I’m an international student from India and planning to apply for an MBA in the U.S. with a concentration in Supply Chain, Operations, or Business Analytics.

My background:

Currently finishing a BBA

Likely to have a 6-month internship, but no full-time work experience

Interested in entering the U.S. job market for 1–2 years, then starting my own logistics/trucking business

My questions:
– Is it realistic to get into a good MBA program in this field without full-time work experience?
– Will I be at a disadvantage during recruiting as a fresher international student, especially for supply chain roles?
– Would companies be open to sponsoring international MBA grads in this domain (SCM/Operations)?

Would love to hear from anyone who’s gone through this or seen others succeed (or struggle). Thanks in advance 🙏",1752737393.0,MBA,Business
1m1kerk,IB Summer Associate to Full-Time Re-Recruiting,"Just entered the final month of my Summer Associate internship and very confident that I will receive a full-time offer. 

Great team, great deal experience and all that, but looking to re-recruit for some combination of better bank/group/location. If anyone has any insight on how to navigate this process and approximate timelines on when to start reaching out, I would be immensely grateful!

Any and all feedback would be greatly appreciated, but some targeted questions that come top of mind:

1.  At about what point do teams know how many spots that may still need to fill? (Would imagine there’s two angles - how many FT invites they plan on making, and then how many are accepted)
2. Is it better to reach out to the on-campus recruiting staff, or connections made during summer recruiting? And is there a sweet spot where you’re not too early/eager… but also don’t miss the boat?
3. Which banks tend to re-recruit more heavily? Know this is completely situation dependent, but I know some banks give out an excess of summer offers with attrition built into FT staffing projections.
4. How do FT interviews differ generally? Is it still generic technicals-heavy, or does the conversation now shift to deals worked on from the summer experience?

Found some decent historical posts on the topic, but figured an updated 2025 post might be helpful.

Again, complete understand this varies to a much greater degree than structured Summer recruiting, and even more so by bank and current macro-environment, but would love any and all guidance just the same!",1752690408.0,MBA,Business
1m2470g,BCG Midsummer Review,"I’m a summer C and just got my midsummer review. My green dot / progress bar was pretty squarely in between “demonstrates some behaviors and emerging independence” and “demonstrates strong, reliable performance across behaviors”, about 65-70% of the way to the right of the bar.

What does this mean in terms of return offer odds? I know this has likely already been calibrated by HR so am hoping to crowdsource some opinions since I have no idea how to read the sliding scale.",1752748870.0,MBA,Business
1m206hx,Is an MBA worth it just for future assurance?,"In currently a product designer at a FAANG company and from a comp perspective it doesn’t make sense to get an MBA since I make more than the starting salary of most MBA grads. However, I was thinking about applying to HSW mainly for the networking and social opportunities and also having the MBA for future promotions. 

In tech you don’t really need an MBA for promotions but my goal is to be a C suite level executive and I feel like an MBA will help me get there. The opportunity cost is very significant though but I do see myself working for a while and climbing the corporate ladder.",1752733465.0,MBA,Business
1m1kqfo,"In 5 words or less, describe the people at your  FT MBA",Let’s not be shy,1752691146.0,MBA,Business
1m236gp,Can I go to the school I want to go to?,"Wondering everyone’s thoughts on applying with my stats.

Dream schools: GSB

Tier 2: Berkeley Haas，UCLA Anderson，California is my first choice

Chicago Booth，Michigan Ross，Duke Fuqua，Yale SOM

30F

335 GRE 

Undergraduate GPA 3.0, Master's GPA is 3.5, in an Ivy League school, one class was a C, worked as a TA twice during the master's period

Work background: 7 years in investment banking + 1 entrepreneurial experience (non-CEO/cofounder)

Recommendation letter: Recommendation letter from a master's degree mentor + PE/VC recommender

Beyond job，I have some experience in sports and I am a marathon grand slam runner.

Outside of that, there isn’t anything that exciting about me like many other people here.

I don't know if my gpa is a weakness? It doesn’t seem like I can compete with people who have the total package. 

How do you decide on my application?

 Which of the above school selection options have a higher probability? Which of them can get a scholarship?",1752745115.0,MBA,Business
